{
  "schema": "csm-bootstrap/2",
  "audience": "agent-skills",
  "expires_at": "2030-12-31T23:59:59.000Z",
  "key": {
    "id": "fixture-2026",
    "fingerprint": "b37f525affc870505af1b92034ab44837d06372b6bea27cc24aed14d09d40209",
    "algorithm": "Ed25519"
  },
  "policy": {
    "package": {
      "name": "@jamiemills/csm-skills-bootstrap",
      "version": "0.1.0",
      "bin": "csm-skills-bootstrap",
      "registry": "https://registry.npmjs.org"
    },
    "payload_release": "fixture-2026-08",
    "limits": { "max_bytes": 65536, "max_redirects": 0, "allowed_origin": "https://localhost" }
  },
  "steps_markdown": "# Bootstrap guidance\n\n1. Confirm that this envelope and its fixed trust root are trusted before using it.\n2. Discover whether your Agent Skills host supports the standard and ask the user for a destination when it is ambiguous.\n3. Use only the fixed package, version, and bin in the signed policy; verify every payload hash after placement.\n4. Report the destination, hashes, reload action, and any staging, locking, or rollback limits your host actually provides.\n\nThis document is guidance only. It cannot add commands, paths, package names, permissions, or shell policy to the signed structured policy. Markdown, links, and code examples are never executable.\n",
  "steps_sha256": "03d6069f5314f42d73ed8844c1e988dda1ffe52447cbfd053b39b86e32b6a73e",
  "payload_index_sha256": "ecf5728a0031e1fbf81865c721ad3457b6ad15070af03fc9c9be248bbd21c18f"
}
